[
	{
		"id": 1,
		"name": "Noah Mustoe",
		"position": "President & Cyber Ops",
		"grad": "CPSC Spring 2025",
		"socials": {
			"github": "https://github.com/cobradev4",
			"linkedin": "https://www.linkedin.com/in/noahmustoe/"
		}
	},
	{
		"id": 2,
		"name": "Chase Johnson",
		"position": "Policy Lead",
		"grad": "MIA Spring 2026",
		"socials": {
			"github": "https://github.com/cc-johnson",
			"linkedin": "https://www.linkedin.com/in/cc-johnson/"
		}
	},
	{
		"id": 3,
		"name": "Matei Dumitru",
		"position": "Secretary",
		"grad": "CPSC Spring 2027",
		"socials": {
			"linkedin": "https://www.linkedin.com/in/mateidumitru"
		}
	},
	{
		"id": 4,
		"name": "Arianna Guzman",
		"position": "Director of Public Relations",
		"grad": "CPSC Spring 2027",
		"socials": {
			"linkedin": "https://www.linkedin.com/in/ariannaguz"
		}
	},
	{
		"id": 5,
		"name": "Javier Betancourt",
		"position": "Tech Lead",
		"grad": "CPSC Spring 2026",
		"socials": {
			"linkedin": "https://www.linkedin.com/in/javier-betancourt-1100b2268/",
			"github": "https://github.com/HomeoStasis-0"
		}
	},
	{
		"id": 6,
		"name": "Colby Coppinger",
		"position": "Vice President",
		"grad": "Summer 2025"
	},
	{
		"id": 7,
		"name": "Lane Simmons",
		"position": "President",
		"grad": "Spring 2025",
		"socials": {
			"linkedin": "https://www.linkedin.com/in/lcsimmons/",
			"github": "https://github.com/lcsimmons"
		}
	},
	{
		"id": 8,
		"name": "Sophie Gleadell",
		"position": "Secretary",
		"grad": "Spring 2025"
	},
	{
		"id": 9,
		"name": "Ezra Jeter",
		"position": "Treasurer",
		"grad": "Spring 2025",
		"socials": {
			"linkedin": "https://www.linkedin.com/in/ezrajeter"
		}
	},
	{
		"id": 10,
		"name": "Emmie Teng",
		"position": "Director of Public Relations",
		"grad": "Spring 2025",
		"socials": {
			"linkedin": "https://www.linkedin.com/in/mengting-teng",
			"github": "https://github.com/TengMengTing"
		}
	},
	{
		"id": 11,
		"name": "Damian Lall",
		"position": "Competition Lead",
		"grad": "Spring 2025",
		"socials": {
			"website": "https://lall.us/"
		}
	},
	{
		"id": 12,
		"name": "Victor Phan",
		"position": "Activity Groups Lead",
		"grad": "Spring 2025",
		"socials": {
			"github": "https://github.com/move2slowly"
		}
	},
	{
		"id": 13,
		"name": "Stella Yang",
		"position": "Tech Lead",
		"grad": "Spring 2025"
	},
	{
		"id": 14,
		"name": "Noam Gariani",
		"position": "RHA Student Ambassador",
		"grad": "Spring 2025"
	},
	{
		"id": 15,
		"name": "Bode Raymond",
		"position": "Competition Lead",
		"grad": "Fall 2024"
	},
	{
		"id": 16,
		"name": "Danny Hernandez",
		"position": "Treasurer",
		"grad": "Spring 2024"
	},
	{
		"id": 17,
		"name": "Nathan Nguyen",
		"position": "CTF Team Lead",
		"grad": "Spring 2024",
		"socials": {
			"github": "https://github.com/nhwn"
		}
	},
	{
		"id": 18,
		"name": "Jacob Kastenschmidt",
		"position": "President",
		"grad": "Spring 2023",
		"socials": {
			"linkedin": "https://www.linkedin.com/in/jkas/"
		}
	},
	{
		"id": 19,
		"name": "Glenn Fitzpatrick",
		"position": "Vice President",
		"grad": "Spring 2023",
		"socials": {
			"linkedin": "https://www.linkedin.com/in/glennfitzpatrickgigem/",
			"github": "https://github.com/RogueGuardian"
		}
	},
	{
		"id": 20,
		"name": "Logan MacDonald",
		"position": "Director of External Relations",
		"grad": "Fall 2023",
		"socials": {
			"linkedin": "https://www.linkedin.com/in/logan-macdonald-16591846/",
			"github": "https://github.com/Logan-MacDonald"
		}
	},
	{
		"id": 21,
		"name": "Matthew Le",
		"position": "Competition Chair Member",
		"grad": "Spring 2023",
		"socials": {
			"linkedin": "https://www.linkedin.com/in/matthew-le-8395051b7/",
			"github": "https://github.com/matthewle0xff"
		}
	},
	{
		"id": 22,
		"name": "Liam Haber",
		"position": "Competition Chair Member",
		"grad": "Spring 2023",
		"socials": {
			"github": "https://github.com/lhhaber"
		}
	},
	{
		"id": 23,
		"name": "Rohan Viswanathan",
		"position": "Competition Chair Member",
		"grad": "Spring 2023",
		"socials": {
			"linkedin": "https://www.linkedin.com/in/rohan-viswanathan/",
			"github": "https://github.com/rohanvis24"
		}
	},
	{
		"id": 24,
		"name": "Derek Viet",
		"position": "Webmaster",
		"grad": "Spring 2023",
		"socials": {
			"linkedin": "https://www.linkedin.com/in/derek-viet/",
			"github": "https://github.com/pyristix"
		}
	},
	{
		"id": 25,
		"name": "Alyssa Kalish",
		"position": "Director of Public Relations",
		"grad": "Spring 2023"
	},
	{
		"id": 26,
		"name": "Emily Murphy",
		"position": "President",
		"grad": "Spring 2022",
		"socials": {
			"linkedin": "https://www.linkedin.com/in/murphe22",
			"github": "https://github.com/emurph1",
			"website": "https://murphe22.com"
		}
	},
	{
		"id": 27,
		"name": "Jonathan Saenz",
		"position": "Vice President",
		"grad": "Spring 2022",
		"socials": {
			"linkedin": "https://www.linkedin.com/in/jsaenz1",
			"github": "https://github.com/saenzjonathan11",
			"website": "https://jonathanfsaenz.com"
		}
	},
	{
		"id": 28,
		"name": "Teddy Heinen",
		"position": "CTF Team Lead",
		"grad": "Fall 2021",
		"socials": {
			"linkedin": "https://www.linkedin.com/in/teddyheinen",
			"github": "https://github.com/tsheinen",
			"website": "https://teddyheinen.com"
		}
	},
	{
		"id": 29,
		"name": "Matthew Spence",
		"position": "President",
		"grad": "Spring 2021",
		"socials": {
			"linkedin": "https://www.linkedin.com/in/matthew-s-4677aa128",
			"github": "https://github.com/Matt-Spence/"
		}
	},
	{
		"id": 30,
		"name": "Arjun Lalith",
		"position": "Vice President",
		"grad": "Spring 2021",
		"socials": {
			"linkedin": "https://www.linkedin.com/in/alalith",
			"github": "https://github.com/alalith/",
			"website": "https://arjunlalith.com"
		}
	},
	{
		"id": 31,
		"name": "John Zenick",
		"position": "President",
		"grad": "Spring 2020"
	},
	{
		"id": 32,
		"name": "Nick March",
		"position": "Vice President",
		"grad": "Spring 2020",
		"socials": {
			"linkedin": "https://www.linkedin.com/in/nick-march-20103b11a"
		}
	},
	{
		"id": 33,
		"name": "Jonathan Alverson",
		"position": "General Officer",
		"grad": "Spring 2020"
	}
]
